{
  "glossary_id": "mrd-and-relapse-measurement-glossary-v0",
  "date": "2026-04-14",
  "disease_program": "multiple-myeloma",
  "title": "MRD And Relapse Measurement Glossary v0",
  "blood_cancer_scope": [
    "multiple myeloma",
    "measurable residual disease",
    "response assessment",
    "relapse assessment"
  ],
  "clinical_use_boundary": "research-use-only",
  "source_ids": [
    "nci_pdq_myeloma_hp",
    "pubmed_kumar_2016_imwg_mrd_response_criteria",
    "pubmed_munshi_2017_mrd_survival_meta_analysis",
    "pubmed_soh_2022_mrd_flow_harmonization",
    "pubmed_antigen_escape_bcma_directed_2024",
    "pubmed_di_meo_2025_sema4a_low_bcma"
  ],
  "terms": [
    {
      "term_id": "measurable-residual-disease",
      "label": "Measurable residual disease",
      "term_kind": "measurement-boundary",
      "definition": "A sensitive measurement frame for residual myeloma after treatment response, also called minimal residual disease in many sources.",
      "measurement_context": [
        "Requires method, specimen, threshold, and timing before comparison.",
        "May refer to marrow-based assays, imaging-linked response categories, or study-specific endpoint definitions."
      ],
      "source_ids": [
        "pubmed_kumar_2016_imwg_mrd_response_criteria",
        "pubmed_munshi_2017_mrd_survival_meta_analysis"
      ],
      "related_term_ids": [
        "mrd-negativity",
        "mrd-sensitivity-threshold",
        "bone-marrow-mrd"
      ],
      "use_in_public_artifacts": [
        "Use as the umbrella term for highly sensitive residual disease measurement.",
        "Record the source's exact terminology when it uses minimal residual disease instead."
      ],
      "what_not_to_infer": [
        "Do not treat MRD status as a cure claim.",
        "Do not treat an MRD label as comparable across studies without method context."
      ],
      "limitations": [
        "MRD meaning depends on assay, threshold, specimen quality, timing, and disease distribution."
      ]
    },
    {
      "term_id": "mrd-negativity",
      "label": "MRD negativity",
      "term_kind": "response-category",
      "definition": "A source-defined state in which residual clonal plasma cells are not detected by a specified MRD method at a specified threshold and time point.",
      "measurement_context": [
        "Pair with assay method, sensitivity threshold, specimen source, time point, and response category.",
        "The IMWG consensus criteria include marrow MRD categories with a minimum sensitivity of 10^-5 or better."
      ],
      "source_ids": [
        "pubmed_kumar_2016_imwg_mrd_response_criteria",
        "pubmed_munshi_2017_mrd_survival_meta_analysis"
      ],
      "related_term_ids": [
        "mrd-sensitivity-threshold",
        "flow-cytometry-mrd",
        "sequencing-mrd",
        "sustained-mrd-negativity"
      ],
      "use_in_public_artifacts": [
        "Use only with the method and threshold that produced the result.",
        "Separate single time-point negativity from sustained negativity."
      ],
      "what_not_to_infer": [
        "Do not read negative as no disease exists anywhere.",
        "Do not claim cure from MRD negativity alone."
      ],
      "limitations": [
        "Sampling and assay sensitivity can produce false reassurance if context is missing."
      ]
    },
    {
      "term_id": "mrd-sensitivity-threshold",
      "label": "MRD sensitivity threshold",
      "term_kind": "assay-context",
      "definition": "The stated detection sensitivity or limit used to interpret an MRD result, such as 10^-5 when the source specifies it.",
      "measurement_context": [
        "Record the threshold separately from the method name.",
        "Thresholds should be source-stated, not inferred from a general assay family."
      ],
      "source_ids": [
        "pubmed_kumar_2016_imwg_mrd_response_criteria",
        "pubmed_soh_2022_mrd_flow_harmonization"
      ],
      "related_term_ids": [
        "mrd-negativity",
        "flow-cytometry-mrd",
        "sequencing-mrd"
      ],
      "use_in_public_artifacts": [
        "Use for comparing whether two MRD claims were measured at similar depth.",
        "Flag MRD claims with missing or ambiguous threshold."
      ],
      "what_not_to_infer": [
        "Do not assume every study used 10^-5.",
        "Do not assume a lower numerical detection limit makes results clinically interchangeable."
      ],
      "limitations": [
        "Laboratory validation, sample quality, and analysis approach still matter even when thresholds match."
      ]
    },
    {
      "term_id": "bone-marrow-mrd",
      "label": "Bone marrow MRD",
      "term_kind": "specimen-context",
      "definition": "MRD assessment performed on a bone marrow aspirate or related marrow sample.",
      "measurement_context": [
        "Record aspirate source, adequacy, method, threshold, and timing.",
        "Interpret with caution when disease may be patchy or extramedullary."
      ],
      "source_ids": [
        "pubmed_kumar_2016_imwg_mrd_response_criteria",
        "pubmed_soh_2022_mrd_flow_harmonization"
      ],
      "related_term_ids": [
        "flow-cytometry-mrd",
        "sequencing-mrd",
        "imaging-plus-mrd"
      ],
      "use_in_public_artifacts": [
        "Use as the specimen context for marrow-based flow or sequencing MRD claims.",
        "Capture sample timing relative to therapy."
      ],
      "what_not_to_infer": [
        "Do not assume marrow MRD captures every disease site.",
        "Do not compare marrow MRD with imaging endpoints without saying they measure different contexts."
      ],
      "limitations": [
        "Marrow sampling can miss spatially uneven disease or extramedullary disease."
      ]
    },
    {
      "term_id": "flow-cytometry-mrd",
      "label": "Flow cytometry MRD",
      "term_kind": "assay-context",
      "definition": "MRD assessment using flow cytometry to identify phenotypically aberrant clonal plasma cells.",
      "measurement_context": [
        "Record whether next-generation flow or another validated method was used.",
        "Record analysis approach, sensitivity, and sample adequacy when available."
      ],
      "source_ids": [
        "pubmed_kumar_2016_imwg_mrd_response_criteria",
        "pubmed_soh_2022_mrd_flow_harmonization"
      ],
      "related_term_ids": [
        "mrd-sensitivity-threshold",
        "bone-marrow-mrd"
      ],
      "use_in_public_artifacts": [
        "Use for flow-based MRD claims and extraction fields.",
        "Prefer source-stated method details before cross-study comparison."
      ],
      "what_not_to_infer": [
        "Do not compare flow results across studies without harmonization context.",
        "Do not assume a generic flow label identifies the exact sensitivity."
      ],
      "limitations": [
        "Panel design, acquisition depth, analysis strategy, and specimen quality affect interpretation."
      ]
    },
    {
      "term_id": "sequencing-mrd",
      "label": "Sequencing MRD",
      "term_kind": "assay-context",
      "definition": "MRD assessment using sequencing-based detection of clonal plasma-cell markers in a sample.",
      "measurement_context": [
        "Record platform or validated equivalent and the stated sensitivity threshold.",
        "Record specimen and timing alongside the sequencing result."
      ],
      "source_ids": [
        "pubmed_kumar_2016_imwg_mrd_response_criteria"
      ],
      "related_term_ids": [
        "mrd-sensitivity-threshold",
        "bone-marrow-mrd"
      ],
      "use_in_public_artifacts": [
        "Use for sequencing-based MRD claims and extraction fields.",
        "Separate sequencing MRD from flow MRD unless a source explicitly compares them."
      ],
      "what_not_to_infer": [
        "Do not treat sequencing and flow as interchangeable without context.",
        "Do not infer clinical actionability from platform name alone."
      ],
      "limitations": [
        "Sequencing results depend on assay validation, baseline clone identification, sample quality, and threshold."
      ]
    },
    {
      "term_id": "imaging-plus-mrd",
      "label": "Imaging plus MRD",
      "term_kind": "response-category",
      "definition": "A response-assessment context that combines marrow MRD negativity with imaging response criteria.",
      "measurement_context": [
        "Record imaging modality, baseline or prior imaging context, and marrow MRD method.",
        "Use when the source explicitly combines marrow MRD and imaging response."
      ],
      "source_ids": [
        "pubmed_kumar_2016_imwg_mrd_response_criteria",
        "nci_pdq_myeloma_hp"
      ],
      "related_term_ids": [
        "bone-marrow-mrd",
        "mrd-negativity"
      ],
      "use_in_public_artifacts": [
        "Use to separate marrow-only MRD claims from marrow plus imaging response claims.",
        "Flag missing imaging context in relapse or durable-remission comparisons."
      ],
      "what_not_to_infer": [
        "Do not use marrow MRD alone to rule out extramedullary disease.",
        "Do not assume imaging methods are comparable without source details."
      ],
      "limitations": [
        "Imaging interpretation depends on modality, timing, baseline lesions, and response criteria."
      ]
    },
    {
      "term_id": "sustained-mrd-negativity",
      "label": "Sustained MRD negativity",
      "term_kind": "time-window",
      "definition": "MRD negativity confirmed over a specified interval rather than at a single time point.",
      "measurement_context": [
        "The IMWG consensus criteria define sustained MRD negativity using confirmation at least 1 year apart.",
        "Record the exact duration and whether later evaluations extend the duration claim."
      ],
      "source_ids": [
        "pubmed_kumar_2016_imwg_mrd_response_criteria"
      ],
      "related_term_ids": [